{
  "$schema": "https://json-schema.org/draft/2020-12/schema",
  "$id": "https://simai.io/schema/framework/unit-passport.v1.json",
  "x-simai-version": "1.0.0",
  "title": "SIMAI Framework unit passport",
  "description": "The identity card of one unit a source publishes (standard simai.linkage): a stable id, a version, its owner, the files that make it, one content hash over them and the units it depends on. A class component, a utility folder or a plugin keeps it as passport.json in its folder; a unit whose files do not sit in one folder of its own (a token set, a font, an icon set, a shared module, the core) keeps it under src/core/passports/<id>.json and names its files through includes. A Smart component and a host port are not given a file: their passports are derived from component.json and from the port's edition folders. scripts/linkage.mjs writes files, content_sha256 and dependencies; a person writes the version.",
  "type": "object",
  "additionalProperties": false,
  "required": [
    "schema",
    "schema_version",
    "id",
    "kind",
    "version",
    "owner",
    "files",
    "content_sha256",
    "dependencies"
  ],
  "properties": {
    "schema": {
      "const": "simai.framework.unit-passport"
    },
    "schema_version": {
      "const": 1
    },
    "id": {
      "type": "string",
      "pattern": "^[a-z][a-z0-9-]*\\.[a-z0-9][a-z0-9.-]*$",
      "description": "<kind>.<name>, never reused or silently renamed (simai.linkage id-never-changes)."
    },
    "kind": {
      "enum": [
        "component",
        "utility",
        "plugin",
        "smart",
        "port",
        "tokens",
        "font",
        "icons",
        "module",
        "core"
      ],
      "description": "The part of the id before the first dot."
    },
    "version": {
      "type": "string",
      "pattern": "^(0|[1-9][0-9]*)\\.(0|[1-9][0-9]*)\\.(0|[1-9][0-9]*)$",
      "description": "major.minor.patch with the meaning of simai.linkage semver-meaning; it moves whenever content_sha256 moves against the previous release."
    },
    "owner": {
      "type": "string",
      "minLength": 1,
      "description": "The repository that owns the unit, e.g. simai/ui-source."
    },
    "summary": {
      "type": "string",
      "minLength": 1
    },
    "includes": {
      "type": "array",
      "minItems": 1,
      "uniqueItems": true,
      "items": {
        "type": "string",
        "pattern": "^src/[^\\s]+$"
      },
      "description": "What the unit claims: a path ending in / claims every committed file under it, any other path claims that file. A file belongs to the unit whose claim is the longest; two equal claims are a defect. A passport.json in a folder claims its folder implicitly and omits this."
    },
    "files": {
      "type": "array",
      "uniqueItems": true,
      "items": {
        "type": "string",
        "pattern": "^src/[^\\s]+$"
      },
      "description": "Every file of the unit, repository-relative, in ascending byte order. Passport files are never part of a unit."
    },
    "content_sha256": {
      "type": "string",
      "pattern": "^[a-f0-9]{64}$",
      "description": "SHA-256 over the files in the order listed: for each file its path (UTF-8), a zero byte, its length in bytes as decimal digits, a zero byte, then its bytes. Computed from the committed tree, not the working tree."
    },
    "dependencies": {
      "type": "array",
      "items": {
        "type": "object",
        "additionalProperties": false,
        "required": [
          "id",
          "range"
        ],
        "properties": {
          "id": {
            "type": "string",
            "pattern": "^[a-z][a-z0-9-]*\\.[a-z0-9][a-z0-9.-]*$"
          },
          "range": {
            "type": "string",
            "pattern": "^\\^(0|[1-9][0-9]*)\\.(0|[1-9][0-9]*)\\.(0|[1-9][0-9]*)$",
            "description": "The versions accepted: a caret range, ^major.minor.patch (same major and not lower; for 0.x the same minor)."
          },
          "manual": {
            "const": true,
            "description": "Declared by a person, not found in the code; scripts/linkage.mjs --write keeps it."
          }
        }
      },
      "description": "The units this one uses, each with the range it accepts: the units its rule names as relations, the files its stylesheets and scripts import or load by url(), and the foundations whose custom properties it reads. A dependency found in the code but missing here fails the check; one a person adds by hand is marked manual and kept."
    },
    "former_ids": {
      "type": "array",
      "items": {
        "type": "object",
        "additionalProperties": false,
        "required": [
          "id",
          "journal"
        ],
        "properties": {
          "id": {
            "type": "string",
            "pattern": "^[a-z][a-z0-9-]*\\.[a-z0-9][a-z0-9.-]*$"
          },
          "journal": {
            "type": "string",
            "minLength": 1,
            "description": "The change journal record of the rename (contracts/changes/journal.json)."
          }
        }
      },
      "description": "Earlier ids of this unit (simai.linkage id-never-changes)."
    }
  }
}
