{
  "schema": "simai.framework.unit-passport",
  "schema_version": 1,
  "id": "component.tooltip",
  "kind": "component",
  "version": "1.0.0",
  "owner": "simai/ui-source",
  "files": [
    "src/component/tooltip/docs/docs.md",
    "src/component/tooltip/index.js",
    "src/component/tooltip/js/_tooltip.js",
    "src/component/tooltip/js/index.js",
    "src/component/tooltip/rule.js",
    "src/component/tooltip/scss/_css__tooltip.scss",
    "src/component/tooltip/scss/_css__tooltip_custom.scss",
    "src/component/tooltip/scss/index.scss"
  ],
  "content_sha256": "70d7bdba83ae3bdb8c7f34164250fe0bcebbcb2452fc719b3a0da666976c7c81",
  "dependencies": [
    {
      "id": "core.runtime",
      "range": "^1.0.0"
    },
    {
      "id": "module.component-shared",
      "range": "^1.0.0"
    },
    {
      "id": "tokens.border",
      "range": "^1.0.0"
    },
    {
      "id": "tokens.colour",
      "range": "^1.0.0"
    },
    {
      "id": "tokens.size",
      "range": "^1.0.0"
    },
    {
      "id": "tokens.space",
      "range": "^1.0.0"
    },
    {
      "id": "tokens.typography",
      "range": "^1.0.0"
    }
  ]
}
