{
  "schema": "simai.framework.unit-passport",
  "schema_version": 1,
  "id": "core.runtime",
  "kind": "core",
  "version": "1.0.4",
  "owner": "simai/ui-source",
  "summary": "The core runtime: the Loader, the Smart base, the composition runtime and the contracts it reads; everything under src/core that no token set, font, port or the core sheet claims.",
  "includes": [
    "src/core/"
  ],
  "files": [
    "src/core/contracts/adaptive-sizing.schema.json",
    "src/core/contracts/adaptive-sizing.v1.json",
    "src/core/contracts/composite-host-port.v1.schema.json",
    "src/core/contracts/composition-document.v1.schema.json",
    "src/core/contracts/composition-editor-field-kind.v1.schema.json",
    "src/core/contracts/composition-editor-field-kinds.v1.json",
    "src/core/contracts/composition-editor-fields-v1/README.md",
    "src/core/contracts/composition-editor-fields-v1/checks/normalization-parity.php",
    "src/core/contracts/composition-editor-fields-v1/checks/schemas.py",
    "src/core/contracts/composition-editor-fields-v1/contract.lock.json",
    "src/core/contracts/composition-editor-fields-v1/fixtures/field-kinds.json",
    "src/core/contracts/composition-editor-manifest.v1.schema.json",
    "src/core/contracts/composition-editor-manifests.v1.json",
    "src/core/contracts/composition-port-manifest.v1.schema.json",
    "src/core/contracts/composition-ports.v1.json",
    "src/core/contracts/composition-recipe-v1/README.md",
    "src/core/contracts/composition-recipe-v1/checks/canonical.php",
    "src/core/contracts/composition-recipe-v1/checks/current-runtime.mjs",
    "src/core/contracts/composition-recipe-v1/checks/schemas.py",
    "src/core/contracts/composition-recipe-v1/common.schema.json",
    "src/core/contracts/composition-recipe-v1/contract.lock.json",
    "src/core/contracts/composition-recipe-v1/dependencies.schema.json",
    "src/core/contracts/composition-recipe-v1/fixtures/canonicalization.json",
    "src/core/contracts/composition-recipe-v1/fixtures/format-names.json",
    "src/core/contracts/composition-recipe-v1/fixtures/header-switch.json",
    "src/core/contracts/composition-recipe-v1/fixtures/limit-boundaries.json",
    "src/core/contracts/composition-recipe-v1/fixtures/schema-negative.json",
    "src/core/contracts/composition-recipe-v1/inputs.schema.json",
    "src/core/contracts/composition-recipe-v1/limits.json",
    "src/core/contracts/composition-recipe-v1/manifest.schema.json",
    "src/core/contracts/composition-recipe-v1/recipe.schema.json",
    "src/core/contracts/composition-regions-v1/README.md",
    "src/core/contracts/composition-regions-v1/checks/digest-parity.php",
    "src/core/contracts/composition-regions-v1/checks/schemas.py",
    "src/core/contracts/composition-regions-v1/contract.lock.json",
    "src/core/contracts/composition-regions-v1/fixtures/regions.json",
    "src/core/contracts/composition-routing-v1/README.md",
    "src/core/contracts/composition-routing-v1/checks/digest-parity.php",
    "src/core/contracts/composition-routing-v1/checks/schemas.py",
    "src/core/contracts/composition-routing-v1/contract.lock.json",
    "src/core/contracts/composition-routing-v1/fixtures/routing.json",
    "src/core/contracts/composition-routing-v1/fixtures/value-type-names.json",
    "src/core/contracts/composition-type-manifest.v1.schema.json",
    "src/core/contracts/composition-types.v1.json",
    "src/core/contracts/container-conditions.v1.json",
    "src/core/contracts/content-spacing.docs.v1.json",
    "src/core/contracts/dimension-policy.v1.json",
    "src/core/contracts/effect.v1.schema.json",
    "src/core/contracts/interface-fragment.v1.schema.json",
    "src/core/contracts/packages/larena.package.json",
    "src/core/contracts/public-js-api.json",
    "src/core/contracts/public-variables.v1.json",
    "src/core/contracts/public-variables.v1.schema.json",
    "src/core/contracts/smart-rule-forwards.v1.json",
    "src/core/contracts/third-party-notices.v1.json",
    "src/core/contracts/unit-change-report.v1.schema.json",
    "src/core/contracts/unit-inventory.v1.schema.json",
    "src/core/contracts/unit-passport.v1.schema.json",
    "src/core/contracts/utility-module-aliases.v1.json",
    "src/core/index.js",
    "src/core/js/ComponentObserver.js",
    "src/core/js/alias-table.js",
    "src/core/js/aliases.js",
    "src/core/js/assembly/core.mjs",
    "src/core/js/assembly/definition.mjs",
    "src/core/js/assembly/host.mjs",
    "src/core/js/assembly/index.mjs",
    "src/core/js/assembly/journal.mjs",
    "src/core/js/assembly/link.mjs",
    "src/core/js/assembly/logic.mjs",
    "src/core/js/assembly/values.mjs",
    "src/core/js/assembly/words.mjs",
    "src/core/js/cacheCodec.js",
    "src/core/js/composition/builtins.mjs",
    "src/core/js/composition/canonical.mjs",
    "src/core/js/composition/editor.mjs",
    "src/core/js/composition/fields.mjs",
    "src/core/js/composition/fragments.mjs",
    "src/core/js/composition/index.mjs",
    "src/core/js/composition/inline-editor.mjs",
    "src/core/js/composition/inline-model.mjs",
    "src/core/js/composition/manifest-host.mjs",
    "src/core/js/composition/overlay.mjs",
    "src/core/js/composition/recipe.mjs",
    "src/core/js/composition/regions.mjs",
    "src/core/js/composition/routing.mjs",
    "src/core/js/composition/schema-name.mjs",
    "src/core/js/composition/sortable-inserter.mjs",
    "src/core/js/composition/sortable.mjs",
    "src/core/js/control-spacing.js",
    "src/core/js/deprecations.js",
    "src/core/js/effects.js",
    "src/core/js/element-manifest.js",
    "src/core/js/host-port.js",
    "src/core/js/iconSubsetRuntime.js",
    "src/core/js/index.js",
    "src/core/js/instance-path.js",
    "src/core/js/internal.js",
    "src/core/js/layer-stack.js",
    "src/core/js/loader.js",
    "src/core/js/mask.js",
    "src/core/js/notify.js",
    "src/core/js/open-surface-mark.js",
    "src/core/js/page-actions.js",
    "src/core/js/page-language.js",
    "src/core/js/page-storage.js",
    "src/core/js/pending-tags.js",
    "src/core/js/position-placement.js",
    "src/core/js/position.js",
    "src/core/js/preferences.js",
    "src/core/js/preloader.js",
    "src/core/js/public-path.js",
    "src/core/js/ready.js",
    "src/core/js/region-navigation.js",
    "src/core/js/rule.js",
    "src/core/js/rule.src.js",
    "src/core/js/runtime.js",
    "src/core/js/sanitize.js",
    "src/core/js/smart-base.js",
    "src/core/js/stableHash.js",
    "src/core/js/tailwind-map.js",
    "src/core/js/template-utilities.generated.json",
    "src/core/js/theme-palette.js",
    "src/core/js/utilityModuleAliases.js",
    "src/core/js/vendor/material-color-utilities/LICENSE",
    "src/core/js/vendor/material-color-utilities/hct/cam16.js",
    "src/core/js/vendor/material-color-utilities/hct/hct.js",
    "src/core/js/vendor/material-color-utilities/hct/hct_solver.js",
    "src/core/js/vendor/material-color-utilities/hct/viewing_conditions.js",
    "src/core/js/vendor/material-color-utilities/package.json",
    "src/core/js/vendor/material-color-utilities/palettes/tonal_palette.js",
    "src/core/js/vendor/material-color-utilities/utils/color_utils.js",
    "src/core/js/vendor/material-color-utilities/utils/math_utils.js",
    "src/core/js/vendor/material-color-utilities/utils/string_utils.js",
    "src/core/rule.js",
    "src/core/smart-base.js",
    "src/core/types/smart-components.d.ts",
    "src/core/utility-full.js"
  ],
  "content_sha256": "65214cc222edaba7750062e8912df11ca912f4e461f47a1414f661765ad0760e",
  "dependencies": [
    {
      "id": "core.styles",
      "range": "^1.0.0"
    },
    {
      "id": "tokens.colour",
      "range": "^1.0.0"
    }
  ]
}
